{
  "$schema": "https://json-schema.org/draft/2020-12/schema",
  "$id": "https://kontourai.dev/schemas/flow-agents/kit-observability-contribution/1.0.json",
  "title": "Kit observability contribution",
  "type": "object",
  "additionalProperties": false,
  "required": ["apiVersion", "kind", "metadata", "spec"],
  "properties": {
    "apiVersion": { "const": "flowagents.kontourai.io/v1alpha1" },
    "kind": { "const": "KitObservabilityContribution" },
    "metadata": { "$ref": "#/$defs/metadata" },
    "spec": { "$ref": "#/$defs/spec" }
  },
  "$defs": {
    "identifier": { "type": "string", "pattern": "^[a-z][a-z0-9-]{0,62}$" },
    "reference": { "type": "string", "minLength": 1, "maxLength": 512, "pattern": "^[^\\u0000-\\u001f\\u007f\\s]+$" },
    "metadata": { "type": "object", "additionalProperties": false, "required": ["name"], "properties": { "name": { "$ref": "#/$defs/identifier" } } },
    "projectionKind": { "enum": ["run_summary", "metric_series", "queue", "grounded_narrative", "learning"] },
    "projection": { "type": "object", "additionalProperties": false, "required": ["schema_ref"], "properties": { "schema_ref": { "$ref": "#/$defs/reference" } } },
    "projections": {
      "type": "object", "additionalProperties": false,
      "properties": {
        "run_summary": { "$ref": "#/$defs/projection" }, "metric_series": { "$ref": "#/$defs/projection" }, "queue": { "$ref": "#/$defs/projection" }, "grounded_narrative": { "$ref": "#/$defs/projection" }, "learning": { "$ref": "#/$defs/projection" }
      },
      "anyOf": [{ "required": ["run_summary"] }, { "required": ["metric_series"] }, { "required": ["queue"] }, { "required": ["grounded_narrative"] }, { "required": ["learning"] }]
    },
    "authorityRefs": {
      "type": "object", "additionalProperties": false,
      "properties": { "flow": { "$ref": "#/$defs/reference" }, "surface": { "$ref": "#/$defs/reference" }, "runtime": { "$ref": "#/$defs/reference" } },
      "anyOf": [{ "required": ["flow"] }, { "required": ["surface"] }, { "required": ["runtime"] }]
    },
    "host": {
      "type": "object", "additionalProperties": false, "required": ["required_capabilities", "optional_capabilities", "presentation"],
      "properties": {
        "required_capabilities": { "const": ["standard_views"] },
        "optional_capabilities": { "const": ["mcp_apps_resource_bridge"] },
        "presentation": { "type": "object", "additionalProperties": false, "required": ["preferred", "fallback"], "properties": { "preferred": { "const": "mcp_apps_resource_bridge" }, "fallback": { "const": "standard_views" } } }
      }
    },
    "dataPolicy": { "type": "object", "additionalProperties": false, "required": ["redaction", "retention", "raw_source"], "properties": { "redaction": { "const": "declared" }, "retention": { "const": "kit_owned" }, "raw_source": { "enum": ["available", "unavailable"] } } },
    "target": { "type": "object", "additionalProperties": false, "required": ["authority", "kind"], "properties": { "authority": { "enum": ["flow", "surface", "runtime"] }, "kind": { "enum": ["workflow_run", "work_item", "narrative", "queue_item"] } } },
    "operatorIntent": {
      "oneOf": [
        { "type": "object", "additionalProperties": false, "required": ["intent", "label", "required_capability", "target"], "properties": { "intent": { "const": "open_resource" }, "label": { "type": "string", "minLength": 1, "maxLength": 120 }, "required_capability": { "const": "resource.open" }, "target": { "$ref": "#/$defs/target" } } },
        { "type": "object", "additionalProperties": false, "required": ["intent", "label", "required_capability"], "properties": { "intent": { "const": "export_local" }, "label": { "type": "string", "minLength": 1, "maxLength": 120 }, "required_capability": { "const": "export.local" } } },
        { "type": "object", "additionalProperties": false, "required": ["intent", "label", "required_capability", "target"], "properties": { "intent": { "const": "review_proposal" }, "label": { "type": "string", "minLength": 1, "maxLength": 120 }, "required_capability": { "const": "proposal.review" }, "target": { "type": "object", "additionalProperties": false, "required": ["authority", "kind"], "properties": { "authority": { "const": "surface" }, "kind": { "const": "proposal" } } } } }
      ]
    },
    "compatibility": { "type": "object", "additionalProperties": false, "required": ["unsupported_version"], "properties": { "unsupported_version": { "const": "diagnostic" } } },
    "spec": {
      "type": "object", "additionalProperties": false,
      "required": ["contract_version", "projections", "authority_refs", "host", "data_policy", "operator_intents", "compatibility"],
      "properties": { "contract_version": { "const": "1.0" }, "projections": { "$ref": "#/$defs/projections" }, "authority_refs": { "$ref": "#/$defs/authorityRefs" }, "host": { "$ref": "#/$defs/host" }, "data_policy": { "$ref": "#/$defs/dataPolicy" }, "operator_intents": { "type": "array", "items": { "$ref": "#/$defs/operatorIntent" } }, "compatibility": { "$ref": "#/$defs/compatibility" } }
    }
  }
}
